	rank	name	address	link	loc_name	visitor_num	reviews	scores	dates	visit_num
0	1	스시아라타	서울특별시 영등포구 국제금융로8길 16	https://m.place.naver.com/restaurant/1796596446/home?entry=plt	스시아라타	9.0	{0: '친절하시고 맛있어요! 다만, 저한텐 양이 좀 많았어요.', 1: '섬세함이 가득했던 스시', 2: '숙성 스시 다 좋았음', 3: '디너 방문했습니다. 가격대가 있어 다소 부담스러우시나여?? 방문해 보사면 값어치 하는구나 싶으실 겁니다. 여느 호텔 못지 않은 퀄리티 자랑하구요. 쉐프님께서 많이 고민하셨구나 느껴집니다. 전 정말 너무 배불러서 힘들 지경이엇어요 (밥양을 줄였음에도) 좋은 시간이었습니다!', 4: '아....넘 맛나요~ 다음에 또 가려고요!!!', 5: '생맥도 잘 뽑고 쉐프님도 잘생기시고 접객이 좋습니다! 요즘 최애 ❤️한번 갈때 2~3잔은 기본 확실히 평일 런치 1부할때보다 토요일 점 심에 가니 더 세세하게 서비스에 신경 써주시고 츠마미와 네타구성이 훨씬 다양하네요! 5월 가격인상으로 더 좋은 퀄리티 기대하겠습니 다!! 항상 갈때 마다 잘 먹고 있어요! 적게 일하고 많이 버십시오:)', 6: '맛있게 잘 먹었습니다. 감사합니다.', 7: '역시는 역시👍 여의도로 이전하고 요리도 많아지고 보는 재미, 먹는 즐거움이 더 늘었네요. 나올 때는 행복감과 함께하니 언제나 좋아요.', 8: '예약은 어렵지만, 방문한다면 절대 후회하지 않을 곳.'}	{0: 5.0, 1: 4.5, 2: 5.0, 3: 5.0, 4: 5.0, 5: 5.0, 6: 5.0, 7: 5.0, 8: 5.0}	{0: '2020.08.06', 1: '2020.07.30', 2: '2020.07.02', 3: '2020.05.13', 4: '2020.05.13', 5: '2020.04.25', 6: '2020.04.17', 7: '2020.03.21', 8: '2019.03.01'}	{0: '1번째 방문영수증', 1: '1번째 방문영수증', 2: '1번째 방문영수증', 3: '1번째 방문영수증', 4: '1번째 방문영수증', 5: '1번째 방문영수증', 6: '1번째 방문영수증', 7: '1번째 방문영수증', 8: '1번째 방문영수증'}
1	2	오헨	서울특별시 영등포구 의사당대로 127 롯데캐슬엠파이어 1F	https://m.place.naver.com/restaurant/44448487/home?entry=ple	오헨	14.0	{0: '빵은 맛있는데 비싼게 흠이네요 버터프레첼 맛있어요', 1: '크로와상 일품입니다~~엄지척!!!', 2: '친절하십니다', 3: '크로와상 맛있어요!', 4: '크로아상 제대로네요!', 5: '사와서 밤늦게 먹었는데도 속이 편안하네요. 좋은재료 같아요. 맛있어요:)', 6: '엄청 맛있는진 모르겠어요.. 가격이 좀 있는편', 7: '바게트', 8: '#무화과빠베 5000원이나 하는 이 빵이 뭔데 이렇게 좋으냐 테이크아웃만 가능한 아주 작은 바 형태라 사서 맞은편 스벅에서 냠냠', 9: '직원분이 점잖고 착하셔서 좋습니다', 10: '마들렌 너무 맛있어요... 무화과빠베도 맛있고 ㅠㅠㅠㅠㅠㅠㅠㅠ', 11: '크로와상 4000 미니마들렌 2000 올리브치아바타 3500', 12: '맛은 있어요 전부 ㅋㅋ 근데 너무 비쌈', 13: '찾기 힘들어요'}	{0: 4.5, 1: 4.0, 2: 5.0, 3: 5.0, 4: 5.0, 5: 5.0, 6: 3.5, 7: 4.0, 8: 5.0, 9: 5.0, 10: 5.0, 11: 5.0, 12: 4.0, 13: 4.0}	{0: '2020.08.24', 1: '2020.08.13', 2: '2020.07.22', 3: '2020.06.25', 4: '2020.06.15', 5: '2020.06.11', 6: '2020.06.08', 7: '2020.04.16', 8: '2020.03.30', 9: '2020.03.24', 10: '2020.03.19', 11: '2020.03.16', 12: '2020.02.15', 13: '2020.01.09'}	{0: '1번째 방문영수증', 1: '1번째 방문영수증', 2: '1번째 방문영수증', 3: '2번째 방문영수증', 4: '1번째 방문영수증', 5: '1번째 방문영수증', 6: '1번째 방문영수증', 7: '1번째 방문영수증', 8: '1번째 방문영수증', 9: '3번째 방문영수증', 10: '2번째 방문영수증', 11: '1번째 방문영수증', 12: '1번째 방문영수증', 13: '1번째 방문영수증'}
2	3	하쯔호	서울특별시 영등포구 여의동로 213 금호리첸시아 B1	https://m.place.naver.com/restaurant/34625307/home?entry=plt	하쯔호	20.0	{0: '런치도 맛있네요! 첫점으로 나온 히라메 먹고 남친이랑 다담주 디너 예약 결정했어요~', 1: '하나하나 정성껏 만들어주셔서 너무 좋았어요 잘 먹었습니다!', 2: '역시 여의도에서 제일 오래된 스시집인 이유가 있네요 !!너무 맛있어요 ~~', 3: '4주년 기념일로 간거였는데 제대로 더 알아보지 않고 방문한게 후회스러워서 자책 중이예요. 날파리? 날벌레가 계속 날아다니고 첨부 사진과같이 후토마끼가 극명하게 차이나는걸 주시는 곳은 처음이라 너무 당황스러웠어요. 직접 말씀드리기엔 다찌에 저희 외 네분이 더 계셔서 다른 분들을 예로 들며 말하기 민망해서 차마 말씀 드릴 수 없었어요. 식사하고 귀가길에도 계속 속상하더군요. 와인을 좋...', 4: '야에레야에레', 5: '최고의 스시였습니다 재방문하고싶어요', 6: '여기가 여의도에서 제일 맛있는 것 같아요. 일단 스시 나올 때마다 재료 모두 신선하게 느꼈어요. 이 부분이 제일 좋았어요. 오토시로 나 오는 무절임이 여기 시그니처인 것 같아요. 음식과도 잘 어우러지고 계속 먹게됐습니다.. ㅎㅎ 다찌가 크게 두 개로 나뉘어져 있어 넓직 하여 다른 팀 목소리도 울리지 않아 좋았고, 전담 쉐프님도 정말 친절하셨습니다. (장 호 셰프님) 그리고 콜키지가 1병 무료... !! ...', 7: '어의도에서 가장 좋아하는 스시야입니다. 맛, 분위기 하나같이 호불호없는 공간입니다.', 8: '제대로 대접 받는 기분이에요~ 완전 만족입니다~^^', 9: '지인 추천으로 예비 시부모님 모시고 갔어요 시어머니께서 가리시는 음식이 좀 있는데 셰프님이 신경써주셨어요 시부모님께서 맛있다고 흡족해하셨어요 남친도 맛있다고 사진찍고 난리였는데 저는 너무 긴장한 나머지 맛을 못느껴서 친구랑 나중에 가려구요 ㅋㅋ', 10: '런치 오마카세 먹었습니다. 계란찜으로 시작해서 스시, 삼치구이, 마끼, 온소바로 구성됐었고 양이 과하지 않아서 하나하나 맛을 다 느낄 수 있어서 좋았습니다', 11: '이 가격에 이정도 오마카세면 매우 훌륭한거 같아요 앵콜?로 두툼김밥은 어렵다하신게 넘 아쉽...', 12: '맛있어요 짱짱', 13: '맛있게 잘 먹었어요', 14: '너무 맜있어요~~~', 15: '좋아하는 지인과 함께 갔네요 초밥 맛이 하나하나 다 다르네요', 16: '여의도에서 수준급 스시 오마카세를 맛볼 수 있는 공간입니다!!', 17: '완벽 그 자체'}	{0: 5.0, 1: 5.0, 2: 5.0, 3: 2.0, 4: 1.0, 5: 5.0, 6: 5.0, 7: 5.0, 8: 5.0, 9: 5.0, 10: 5.0, 11: 5.0, 12: 5.0, 13: 4.5, 14: 5.0, 15: 5.0, 16: 5.0, 17: 5.0, 18: 4.0, 19: 5.0}	{0: '2020.08.28', 1: '2020.08.27', 2: '2020.08.27', 3: '2020.08.26', 4: '2020.08.22', 5: '2020.08.20', 6: '2020.08.19', 7: '2020.08.17', 8: '2020.07.23', 9: '2020.06.19', 10: '2020.05.15', 11: '2020.05.13', 12: '2020.04.20', 13: '2020.03.30', 14: '2020.03.17', 15: '2020.01.13', 16: '2020.01.13', 17: '2019.11.06', 18: '2019.06.30', 19: '2019.06.26'}	{0: '2번째 방문영수증', 1: '1번째 방문영수증', 2: '1번째 방문영수증', 3: '1번째 방문영수증', 4: '1번째 방문영수증', 5: '1번째 방문영수증', 6: '1번째 방문영수증', 7: '1번째 방문영수증', 8: '2번째 방문영수증', 9: '1번째 방문영수증', 10: '1번째 방문영수증', 11: '1번째 방문영수증', 12: '1번째 방문영수증', 13: '1번째 방문영수증', 14: '2번째 방문영수증', 15: '4번째 방문영수증', 16: '3번째 방문영수증', 17: '2번째 방문영수증', 18: '1번째 방문영수증', 19: '1번째 방문영수증'}
